id,text,label,label_name,lang,source_type,seed_template_idx
5d29c545c9d2,"Eicher Motors shares flat हैं, market Q4 results का wait कर रहा है",0,neutral,hinglish,generated,1
2d0a2cdc109f,बजट पूर्व सत्र में टीसीएस और एनर्जी सेक्टर सीमित दायरे में,0,neutral,hi,generated,13
8b257acb61c9,Global markets uncertain — Titan Company in wait-and-watch mode,0,neutral,hinglish,generated,13
3ef668c07126,"ओएनजीसी का निर्यात इतिहास के उच्चतम स्तर पर, शेयर में जोरदार तेजी",1,positive,hi,generated,11
51d25aa8884b,"FII ने SBI Life में neutral stance लिया है, minor buying-selling",0,neutral,hinglish,generated,8
2e20df6d8c54,"Global cues positive, Tata Consumer में buying ka momentum strong है",1,positive,hinglish,generated,0
e7f6bca59a41,"Credit rating affirmed: HDFC Bank AA+ पर stable, कोई बदलाव नहीं",0,neutral,hinglish,generated,0
a5462b6aa9f1,"बैंकिंग सेक्टर सेक्टर में मिश्रित संकेत, टाइटन स्थिर",0,neutral,hi,generated,5
eec6ef1a2e8e,"Analysts का SBI Life पर 'hold' rating, कोई revision नहीं",0,neutral,hinglish,generated,12
57423c33a669,"RBI policy meeting से पहले energy sector में caution, Kotak Mahindra Bank stable",0,neutral,hinglish,generated,3
50e7c742c022,"Market में sideways trend, Pidilite Industries में कोई fresh trigger नहीं",0,neutral,hinglish,generated,7
18320083ff74,"India PMI surge ने metals sector boost किया, Eicher Motors 3.4% चढ़ा",1,positive,hinglish,generated,16
e65046e99a8b,"Nifty rally में Cipla आगे, FII ने heavy buying की",1,positive,hinglish,generated,3
43bfbf153837,Block deal: FII ने Power Grid में ₹500 crore का stake खरीदा,1,positive,hinglish,generated,14
92581d30b30f,"Bullish sentiment: Bajaj Auto में 7.2% की तेजी, brokerage target बढ़ाई",1,positive,hinglish,generated,5
f8e587eacaa6,"Pidilite Industries का margin miss हुआ, analysts ने 'sell' call दी",-1,negative,hinglish,generated,6
80b7cb605907,बजट पूर्व सत्र में ओएनजीसी और बैंकिंग सेक्टर सीमित दायरे में,0,neutral,hi,generated,13
a2b5b1691aaa,"RBI policy meeting से पहले FMCG sector में caution, NTPC stable",0,neutral,hinglish,generated,3
0d47f206967f,बजट पूर्व सत्र में एशियन पेंट्स और बैंकिंग सेक्टर सीमित दायरे में,0,neutral,hi,generated,13
232594be650d,"Bharti Airtel का revenue growth double-digit, stock outperforms Nifty",1,positive,hinglish,generated,15
0dee37188985,"SBI Life का trade volume below average, direction clear नहीं",0,neutral,hinglish,generated,14
1b940dfc17d7,Block deal: FII ने Grasim Industries में ₹500 crore का stake खरीदा,1,positive,hinglish,generated,14
45363193e519,विप्रो प्रमोटर की हिस्सेदारी गिरवी से निवेशक चिंतित,-1,negative,hi,generated,9
5abb21049bcd,"भारती एयरटेल का शुद्ध लाभ Q4 में 2.3% बढ़ा, विश्लेषक हुए उत्साहित",1,positive,hi,generated,3
3f7b1df9bc59,विदेशी निवेशकों ने एलएंडटी में रिकॉर्ड निवेश किया इस सप्ताह,1,positive,hi,generated,15
b5fa14741e41,बजट पूर्व सत्र में ओएनजीसी और टेलीकॉम सेक्टर सीमित दायरे में,0,neutral,hi,generated,13
63fd04bd9708,"RBI की hawkish policy से pharma sector hit, Hero MotoCorp biggest loser",-1,negative,hinglish,generated,18
4498e5692f49,"सिप्ला को बड़ा सरकारी अनुबंध मिला, बाजार में जोरदार उत्साह",1,positive,hi,generated,6
4f8111ca59d4,RBI rate cut से Titan Company और pharma sector में जोरदार rally,1,positive,hinglish,generated,7
aeeae94a8122,"UltraTech Cement का export revenue all-time high, investors में जोश",1,positive,hinglish,generated,8
99e4d7e8505d,"एचडीएफसी बैंक के शेयर 2.1% उछले, मजबूत तिमाही नतीजों ने दिया बड़ा सहारा",1,positive,hi,generated,1
e6454e8985ba,"HDFC Life buyback approved by SEBI, shares jumped 8.3%",1,positive,hinglish,generated,13
9a26990ad71f,Strong quarterly numbers: Dr Reddys का EPS estimate से 3.4% ज़ादा,1,positive,hinglish,generated,18
a4dcfbd76c22,"कच्चे माल की ऊंची लागत से कोटक महिंद्रा बैंक का मार्जिन घटा, शेयर धड़ाम",-1,negative,hi,generated,7
cf6a8a24a83b,बजट पूर्व सत्र में एक्सिस बैंक और एनर्जी सेक्टर सीमित दायरे में,0,neutral,hi,generated,13
f272168fe1b1,"Credit rating affirmed: Apollo Hospitals AA+ पर stable, कोई बदलाव नहीं",0,neutral,hinglish,generated,0
ca6425a6b355,"NTPC का revenue growth double-digit, stock outperforms Nifty",1,positive,hinglish,generated,15
9b1ed3196477,बजट पूर्व सत्र में टाइटन और एफएमसीजी सेक्टर सीमित दायरे में,0,neutral,hi,generated,13
34db1b0725a8,"Bajaj Finance board meeting होगी Friday को, कोई major announcement नहीं",0,neutral,hinglish,generated,4
389eca238111,मजबूत macro data से IndusInd Bank और पूरे financial services sector में तेजी,1,positive,hinglish,generated,12
d99fc0391271,Mixed signals: Apollo Hospitals का revenue beat हुआ लेकिन margins थोड़े miss,0,neutral,hinglish,generated,5
f44c5fed0ab9,"टीसीएस का निर्यात इतिहास के उच्चतम स्तर पर, शेयर में जोरदार तेजी",1,positive,hi,generated,11
34d76d9d1a2f,"बाजार में तेजी: अल्ट्राटेक सीमेंट ने 1.1% की छलांग लगाई, निवेशकों में खुशी",1,positive,hi,generated,2
809bf565c1cc,"एशियन पेंट्स के शेयर सपाट, बाजार Q3 नतीजों का इंतजार कर रहा है",0,neutral,hi,generated,1
9045c94b70e6,"एफआईआई ने आईटीसी में बड़ी खरीदारी की, स्टॉक 1.5% चढ़ा",1,positive,hi,generated,5
7410a9968467,"Credit rating affirmed: Hindalco AA+ पर stable, कोई बदलाव नहीं",0,neutral,hinglish,generated,0
8d326d41f664,"L&T का revenue growth double-digit, stock outperforms Nifty",1,positive,hinglish,generated,15
04192c40ecfc,"Wipro का share 2.6% गिरा, weak Q3 results से investors निराश",-1,negative,hinglish,generated,1
3b2476f912cf,"Bullish sentiment: Tata Motors में 2.3% की तेजी, brokerage target बढ़ाई",1,positive,hinglish,generated,5
364726e68303,"Nifty rally में Tata Motors आगे, FII ने heavy buying की",1,positive,hinglish,generated,3
3c38ce6448be,खराब मानसून अनुमान ने डॉ. रेड्डी की संभावनाओं पर पानी फेरा,-1,negative,hi,generated,19
010be55b1bab,आरबीआई की दर कटौती से कोटक महिंद्रा बैंक और टेलीकॉम सेक्टर में बड़ी तेजी,1,positive,hi,generated,7
e579eba6ac8d,"Hero MotoCorp को regulatory action का सामना, stock tanked 3.3%",-1,negative,hinglish,generated,10
c3e065c7bbe5,"Rising input costs ने HDFC Life को नुकसान पहुंचाया, stock slips 6.3%",-1,negative,hinglish,generated,7
b9df88f4b3ed,Strong quarterly numbers: Bajaj Auto का EPS estimate से 4.2% ज़ादा,1,positive,hinglish,generated,18
385559f9b86a,"FII ने Tata Motors में neutral stance लिया है, minor buying-selling",0,neutral,hinglish,generated,8
8cbbbd9d61fe,"RBI policy meeting से पहले cement sector में caution, Bajaj Auto stable",0,neutral,hinglish,generated,3
b8bdbdc35c8f,Global markets uncertain — ITC in wait-and-watch mode,0,neutral,hinglish,generated,13
f166d7149a07,"आरबीआई की सख्त नीति से हिंदुस्तान यूनिलीवर पर दबाव, 8.6% की गिरावट",-1,negative,hi,generated,8
36a60f487da0,Disappointing earnings: Eicher Motors revenue miss + margin miss double whammy,-1,negative,hinglish,generated,9
57cdb630654c,Block deal: FII ने Eicher Motors में ₹500 crore का stake खरीदा,1,positive,hinglish,generated,14
912df90135e8,"SEBI notice के बाद Adani Enterprises में panic selling, 2.4% की गिरावट",-1,negative,hinglish,generated,4
5a507bc2287a,"फार्मा सेक्टर में मंदी की आहट, इन्फोसिस सबसे बड़ा लूजर",-1,negative,hi,generated,6
32adbbef45a8,"आरबीआई की सख्त नीति से सिप्ला पर दबाव, 4.5% की गिरावट",-1,negative,hi,generated,8
8970ce1034a5,"Hero MotoCorp board meeting होगी Friday को, कोई major announcement नहीं",0,neutral,hinglish,generated,4
4d92a9807834,निफ्टी में बड़ी गिरावट: आईटीसी सबसे ज्यादा टूटने वाले शेयरों में,-1,negative,hi,generated,16
f7f3aa62cd4d,"एशियन पेंट्स पर सेबी की जांच, शेयर में निवेशकों की भाग-दौड़",-1,negative,hi,generated,4
538444954762,"हिंदुस्तान यूनिलीवर के शेयर 3.7% टूटे, कमजोर नतीजों ने बाजार को निराश किया",-1,negative,hi,generated,1
5c5e861f8696,ग्लोबल मंदी की आशंका से टेलीकॉम सेक्टर सेक्टर में एचडीएफसी बैंक पिछड़ा,-1,negative,hi,generated,13
201ee824ab8d,"Analysts का Tech Mahindra पर 'hold' rating, कोई revision नहीं",0,neutral,hinglish,generated,12
90fe5da1c40d,"UltraTech Cement ने rights issue announce किया steep discount पर, stock गिरा",-1,negative,hinglish,generated,19
5d2e1fe94ca1,Strong quarterly numbers: SBI Life का EPS estimate से 2.1% ज़ादा,1,positive,hinglish,generated,18
15060527e90a,"BPCL shares ne 52-week high छुआ, strong earnings के बाद",1,positive,hinglish,generated,4
c997cdcc691e,आरबीआई नीतिगत बैठक से पहले बजाज फाइनेंस में सतर्कता,0,neutral,hi,generated,3
da00e0dd7f94,"ओएनजीसी का वॉल्यूम 10-दिन के औसत से कम, दिशा का इंतजार",0,neutral,hi,generated,12
c6fbf3c72eb5,"HDFC Bank को regulatory action का सामना, stock tanked 4.1%",-1,negative,hinglish,generated,10
b0d2a791e55f,"Credit rating affirmed: Tata Consumer AA+ पर stable, कोई बदलाव नहीं",0,neutral,hinglish,generated,0
d596519bd485,"India PMI surge ने FMCG sector boost किया, Hindustan Unilever 2.1% चढ़ा",1,positive,hinglish,generated,16
19719fc8b6db,मजबूत macro data से Apollo Hospitals और पूरे pharma sector में तेजी,1,positive,hinglish,generated,12
42a2a3191957,हिंदुस्तान यूनिलीवर का तकनीकी चार्ट तटस्थ संकेत दे रहा है,0,neutral,hi,generated,9
9b51d4ef0e45,Weak global cues से Apollo Hospitals और telecom sector दोनों पर pressure,-1,negative,hinglish,generated,5
b71972da49a0,"हिंदुस्तान यूनिलीवर को बड़ा सरकारी अनुबंध मिला, बाजार में जोरदार उत्साह",1,positive,hi,generated,6
5841f3d1154a,आरबीआई की दर कटौती से एनटीपीसी और टेलीकॉम सेक्टर में बड़ी तेजी,1,positive,hi,generated,7
ec0c7e4f2213,Strong quarterly numbers: Maruti Suzuki का EPS estimate से 3.2% ज़ादा,1,positive,hinglish,generated,18
7c08c1bdff9d,"एफआईआई ने कोटक महिंद्रा बैंक में बड़ी खरीदारी की, स्टॉक 3.9% चढ़ा",1,positive,hi,generated,5
b5903fd1fc31,"एचसीएल टेक लेखापरीक्षा में अनियमितता के संकेत, निवेशक हुए सतर्क",-1,negative,hi,generated,0
96122777bf20,"Budget expectations से energy sector flat, Pidilite Industries कोई बड़ी move नहीं",0,neutral,hinglish,generated,11
cfcc82f1021f,"ऑटो सेक्टर सेक्टर में मिश्रित संकेत, अल्ट्राटेक सीमेंट स्थिर",0,neutral,hi,generated,5
7461657e065c,डॉ. रेड्डी का Q2 नतीजा बाजार की उम्मीद से काफी कमजोर,-1,negative,hi,generated,10
2bfa0a0ab8f4,नेस्ले प्रमोटर की हिस्सेदारी गिरवी से निवेशक चिंतित,-1,negative,hi,generated,9
8942ede6bb41,"Bullish sentiment: Pidilite Industries में 1.5% की तेजी, brokerage target बढ़ाई",1,positive,hinglish,generated,5
bbf845642832,RBI rate cut से HCL Technologies और metals sector में जोरदार rally,1,positive,hinglish,generated,7
70856b4205a3,"UltraTech Cement market share 4.5% घटी, competition बढ़ा, stock दबाव में",-1,negative,hinglish,generated,15
b5b909a41517,"सिप्ला का बोर्ड बैठक कल, कोई बड़ा बदलाव नहीं अपेक्षित",0,neutral,hi,generated,4
3e847661991c,Adani Ports का FY26 annual guidance unchanged रहा,0,neutral,hinglish,generated,9
065c86388f71,"एफआईआई ने एसबीआई में बड़ी खरीदारी की, स्टॉक 3.4% चढ़ा",1,positive,hi,generated,5
9d00baf6cf8b,"एचडीएफसी बैंक के शेयर सपाट, बाजार Q1 नतीजों का इंतजार कर रहा है",0,neutral,hi,generated,1
874cd9607718,"Audit concerns raised for Bajaj Auto, investors को घबराहट",-1,negative,hinglish,generated,13
621c8c8ff4a2,Mixed signals: Grasim Industries का revenue beat हुआ लेकिन margins थोड़े miss,0,neutral,hinglish,generated,5
0520362c9416,Market मंदी में BPCL ने 3.7% का नुकसान दिया इस week,-1,negative,hinglish,generated,14
055d4a15070c,"Pidilite Industries का share 3.2% ऊपर गया, Q3 results ने सबको चौंकाया",1,positive,hinglish,generated,1
866f4657bab4,बजट पूर्व सत्र में ओएनजीसी और मेटल सेक्टर सीमित दायरे में,0,neutral,hi,generated,13
a4ca5fbbd6d5,मारुति सुजुकी की बाजार हिस्सेदारी में 5.3% की गिरावट,-1,negative,hi,generated,15
ec5f3425cf22,बाजार विश्लेषकों ने एसबीआई का लक्ष्य मूल्य बढ़ाया,1,positive,hi,generated,18
252f16b590e2,"बाजार में तेजी: टाइटन ने 1.1% की छलांग लगाई, निवेशकों में खुशी",1,positive,hi,generated,2
81310af20ef8,बजट पूर्व सत्र में बजाज फाइनेंस और टेलीकॉम सेक्टर सीमित दायरे में,0,neutral,hi,generated,13
90b84b35c235,Global markets uncertain — Hindustan Unilever in wait-and-watch mode,0,neutral,hinglish,generated,13
82106d1fa0b6,"एफआईआई की बिकवाली से मारुति सुजुकी में भारी गिरावट, 6.3% नुकसान",-1,negative,hi,generated,3
71f0f11c1606,"Maruti Suzuki market share 8.6% घटी, competition बढ़ा, stock दबाव में",-1,negative,hinglish,generated,15
9837d802b4c1,Global markets uncertain — HDFC Bank in wait-and-watch mode,0,neutral,hinglish,generated,13
eec3ba0674d5,"रिलायंस का लाभांश रिकॉर्ड डेट जल्द, मूल्य प्रभाव सीमित",0,neutral,hi,generated,14
db821c795e25,"Rising input costs ने Asian Paints को नुकसान पहुंचाया, stock slips 1.4%",-1,negative,hinglish,generated,7
bf674e2d9ba3,मजबूत macro data से Power Grid और पूरे telecom sector में तेजी,1,positive,hinglish,generated,12
6b284ccbfd7a,शेयर बाजार में रौनक: एसबीआई ने ऊपरी सर्किट लगाया,1,positive,hi,generated,0
0fa10ad8813b,"Bajaj Auto market share 2.4% घटी, competition बढ़ा, stock दबाव में",-1,negative,hinglish,generated,15
ec7c9266a404,"RBI policy meeting से पहले cement sector में caution, Axis Bank stable",0,neutral,hinglish,generated,3
c0e23f06b2a3,बाजार में उतार-चढ़ाव के बीच आईटीसी 200-दिन के औसत पर टिका,0,neutral,hi,generated,8
242e06bb5669,"सरकारी नीति में बदलाव से ऑटो सेक्टर पर मार, मारुति सुजुकी 8.6% नीचे",-1,negative,hi,generated,17
0e38f3b77860,"रिलायंस का पूंजी विस्तार योजना पर काम तेज, शेयर रिकॉर्ड ऊंचाई पर",1,positive,hi,generated,17
e076b8fa534a,मुद्रास्फीति में गिरावट: फार्मा सेक्टर में एचसीएल टेक सबसे बड़ा फायदेमंद,1,positive,hi,generated,19
440718c7ccf8,बाजार विश्लेषकों ने अदानी पोर्ट्स का लक्ष्य मूल्य बढ़ाया,1,positive,hi,generated,18
fc7b8742f090,"Reliance Industries का debt level record high, rating agency ने outlook negative किया",-1,negative,hinglish,generated,12
ad813f25159a,बजट पूर्व सत्र में ओएनजीसी और आईटी सेक्टर सीमित दायरे में,0,neutral,hi,generated,13
807e88205945,RBI rate cut से Eicher Motors और auto sector में जोरदार rally,1,positive,hinglish,generated,7
7390b986bdef,"Reliance Industries का share 2.3% ऊपर गया, Q3 results ने सबको चौंकाया",1,positive,hinglish,generated,1
1de2b2a1528c,"सरकारी नीति में बदलाव से एफएमसीजी सेक्टर पर मार, पावर ग्रिड 3.3% नीचे",-1,negative,hi,generated,17
057b11f1ce66,मुद्रास्फीति में गिरावट: मेटल सेक्टर में टाटा मोटर्स सबसे बड़ा फायदेमंद,1,positive,hi,generated,19
ac41464a8664,Poor monsoon forecast ने Hero MotoCorp की earnings outlook को hurt किया,-1,negative,hinglish,generated,0
b21fa2c75843,आरबीआई की दर कटौती से सन फार्मा और एफएमसीजी सेक्टर में बड़ी तेजी,1,positive,hi,generated,7
0b16b6d9389c,"Eicher Motors board meeting होगी Friday को, कोई major announcement नहीं",0,neutral,hinglish,generated,4
71abfa591168,"India PMI surge ने metals sector boost किया, Britannia 2.7% चढ़ा",1,positive,hinglish,generated,16
2c012dc1aafb,"Budget expectations से telecom sector flat, Hindalco कोई बड़ी move नहीं",0,neutral,hinglish,generated,11
fdb55386f61c,"विप्रो ने FY25 में रिकॉर्ड राजस्व दर्ज किया, शेयर नई ऊंचाई पर",1,positive,hi,generated,4
ad343c19cbb5,"ITC buyback approved by SEBI, shares jumped 6.1%",1,positive,hinglish,generated,13
b486a760aacc,बजट पूर्व सत्र में कोटक महिंद्रा बैंक और टेलीकॉम सेक्टर सीमित दायरे में,0,neutral,hi,generated,13
270052fcc265,सन फार्मा का तकनीकी चार्ट तटस्थ संकेत दे रहा है,0,neutral,hi,generated,9
3ec9ac004a0a,HDFC Life का FY23 annual guidance unchanged रहा,0,neutral,hinglish,generated,9
79bb4daf7b55,Mixed signals: Asian Paints का revenue beat हुआ लेकिन margins थोड़े miss,0,neutral,hinglish,generated,5
b7cb579ecee8,Coal India का FY24 annual guidance unchanged रहा,0,neutral,hinglish,generated,9
0d9e30336bb6,"Dr Reddys market share 3.7% घटी, competition बढ़ा, stock दबाव में",-1,negative,hinglish,generated,15
ce84ae1f75d0,"Bajaj Finance subsidiary का IPO 30x oversubscribed, parent भी चढ़ा",1,positive,hinglish,generated,17
3d6c1d9b4c37,"SEBI notice के बाद ONGC में panic selling, 4.1% की गिरावट",-1,negative,hinglish,generated,4
105c5924c887,बजट पूर्व सत्र में सन फार्मा और फार्मा सेक्टर सीमित दायरे में,0,neutral,hi,generated,13
2a0d7247d076,Wipro ने FY25 Q3 में analyst estimates को beat किया,1,positive,hinglish,generated,11
66726e6e1816,"Nifty rally में HDFC Bank आगे, FII ने heavy buying की",1,positive,hinglish,generated,3
d114f3456337,"एफएमसीजी सेक्टर सेक्टर में मिश्रित संकेत, आईसीआईसीआई बैंक स्थिर",0,neutral,hi,generated,5
8fc90939aa18,बाजार विश्लेषकों ने भारती एयरटेल का लक्ष्य मूल्य बढ़ाया,1,positive,hi,generated,18
50288f27a51b,"RBI की hawkish policy से financial services sector hit, Power Grid biggest loser",-1,negative,hinglish,generated,18
c56916dcabad,खराब मानसून अनुमान ने कोटक महिंद्रा बैंक की संभावनाओं पर पानी फेरा,-1,negative,hi,generated,19
ec41de5aa72d,"FII selling से Wipro crash, 1.4% की भारी गिरावट",-1,negative,hinglish,generated,2
7b90cf1f82ef,"इन्फोसिस के शेयर 3.4% उछले, मजबूत तिमाही नतीजों ने दिया बड़ा सहारा",1,positive,hi,generated,1
eee00edf8e52,विदेशी निवेशकों ने टाटा मोटर्स में रिकॉर्ड निवेश किया इस सप्ताह,1,positive,hi,generated,15
38bfedd7f889,Tax demand notice: Apollo Hospitals को ₹1000 crore का GST notice मिला,-1,negative,hinglish,generated,16
c96ae2e12231,"Analysts का Hero MotoCorp पर 'hold' rating, कोई revision नहीं",0,neutral,hinglish,generated,12
e414f1143b29,SBI 200-day moving average पर support ले रहा है,0,neutral,hinglish,generated,6
b8dd1caf6048,"आईसीआईसीआई बैंक पर सेबी की जांच, शेयर में निवेशकों की भाग-दौड़",-1,negative,hi,generated,4
2474d94b26a8,"HDFC Bank को regulatory action का सामना, stock tanked 2.4%",-1,negative,hinglish,generated,10
4293fb26ae74,"Technical charts पर Infosys neutral zone में है, RSI 50 के पास",0,neutral,hinglish,generated,10
268235abe4d0,शेयर बाजार में रौनक: ओएनजीसी ने ऊपरी सर्किट लगाया,1,positive,hi,generated,0
