id,text,label,label_name,lang,source_type,seed_template_idx
0662d99af628,"टीसीएस का शुद्ध लाभ Q3 में 1.1% बढ़ा, विश्लेषक हुए उत्साहित",1,positive,hi,generated,3
d1ae7eb98ec6,"Technical charts पर Wipro neutral zone में है, RSI 50 के पास",0,neutral,hinglish,generated,10
b5ba8ea77b21,शेयर बाजार में रौनक: एनटीपीसी ने ऊपरी सर्किट लगाया,1,positive,hi,generated,0
054f91f88fda,कमजोर मांग के संकेत से टाइटन का शेयर 2.9% लुढ़का,-1,negative,hi,generated,5
35ca371971a8,"Budget expectations से renewable energy sector flat, Tech Mahindra कोई बड़ी move नहीं",0,neutral,hinglish,generated,11
243f70d8c8a0,इन्फोसिस ने फार्मा सेक्टर में सबसे ज्यादा रिटर्न दिया इस तिमाही,1,positive,hi,generated,8
c186b42b5aff,"Tech Mahindra का share 3.1% गिरा, weak Q3 results से investors निराश",-1,negative,hinglish,generated,1
de4c8fd3dc9f,"RBI की hawkish policy से IT sector hit, Wipro biggest loser",-1,negative,hinglish,generated,18
33c286342eff,"Technical charts पर SBI neutral zone में है, RSI 50 के पास",0,neutral,hinglish,generated,10
47606a76206b,एलएंडटी की बाजार हिस्सेदारी में 4.5% की गिरावट,-1,negative,hi,generated,15
8f19276d15c1,"ऑटो सेक्टर सेक्टर में मिश्रित संकेत, हिंदुस्तान यूनिलीवर स्थिर",0,neutral,hi,generated,5
5c5faed7918b,"Analysts का ONGC पर 'hold' rating, कोई revision नहीं",0,neutral,hinglish,generated,12
39cfd50f9f01,"Technical charts पर Adani Ports neutral zone में है, RSI 50 के पास",0,neutral,hinglish,generated,10
2efa8c212a22,"RBI policy meeting से पहले financial services sector में caution, Kotak Mahindra Bank stable",0,neutral,hinglish,generated,3
fbb7cccdf364,"Analysts का BPCL पर 'hold' rating, कोई revision नहीं",0,neutral,hinglish,generated,12
4e5d0f38e9a8,"एनर्जी सेक्टर सेक्टर में मिश्रित संकेत, पावर ग्रिड स्थिर",0,neutral,hi,generated,5
1e7b16cf0694,आरबीआई की दर कटौती से इन्फोसिस और मेटल सेक्टर में बड़ी तेजी,1,positive,hi,generated,7
41e05e8ebf10,"रिलायंस का बोर्ड बैठक कल, कोई बड़ा बदलाव नहीं अपेक्षित",0,neutral,hi,generated,4
41f72f44350a,"HCL Technologies promoter pledge बढ़ी, investor confidence हिला",-1,negative,hinglish,generated,8
e123776ef90f,बजट पूर्व सत्र में टाटा मोटर्स और टेलीकॉम सेक्टर सीमित दायरे में,0,neutral,hi,generated,13
565062b421d7,"RBI की hawkish policy से pharma sector hit, Tata Consumer biggest loser",-1,negative,hinglish,generated,18
d0cea626365d,Nifty में no clear direction — Coal India range bound movement,0,neutral,hinglish,generated,2
f0de056c8702,"Budget expectations से auto sector flat, Bharti Airtel कोई बड़ी move नहीं",0,neutral,hinglish,generated,11
e627979aaddf,कमजोर मांग के संकेत से नेस्ले का शेयर 8.6% लुढ़का,-1,negative,hi,generated,5
0e158d7e6695,"आईटीसी का डिविडेंड ऐलान, निवेशकों में खुशी की लहर",1,positive,hi,generated,14
7fd121338b7f,सन फार्मा में संस्थागत निवेशकों की हिस्सेदारी अपरिवर्तित,0,neutral,hi,generated,10
f3c40ed13e6c,"Tata Steel का revenue growth double-digit, stock outperforms Nifty",1,positive,hinglish,generated,15
dfd34f59f1a3,"Tata Steel shares ne 52-week high छुआ, strong earnings के बाद",1,positive,hinglish,generated,4
238ab3b968a8,"एसबीआई का डिविडेंड ऐलान, निवेशकों में खुशी की लहर",1,positive,hi,generated,14
fe72a170ff3c,Disappointing earnings: ITC revenue miss + margin miss double whammy,-1,negative,hinglish,generated,9
c56c4eb9ce0d,"मजबूत जीडीपी आंकड़ों से बाजार में जोश, एलएंडटी 4.8% ऊपर",1,positive,hi,generated,9
45a3acb8625c,"Tata Consumer का export revenue all-time high, investors में जोश",1,positive,hinglish,generated,8
f9e2fbb17656,"अप्रैल में सिप्ला की बिक्री 2.7% उछली, बाजार का सेंटिमेंट बुलिश",1,positive,hi,generated,16
f284afd2a5e5,बाजार विश्लेषकों ने जेएसडब्ल्यू स्टील का लक्ष्य मूल्य बढ़ाया,1,positive,hi,generated,18
93e971e96e52,मुद्रास्फीति में गिरावट: ऑटो सेक्टर में आईटीसी सबसे बड़ा फायदेमंद,1,positive,hi,generated,19
f9896b718bd8,कमजोर मांग के संकेत से एलएंडटी का शेयर 1.4% लुढ़का,-1,negative,hi,generated,5
25649e7d60ef,"Nestle India board meeting होगी Friday को, कोई major announcement नहीं",0,neutral,hinglish,generated,4
e8ba7aea7ece,"HDFC Bank का debt level record high, rating agency ने outlook negative किया",-1,negative,hinglish,generated,12
d7e6e32c2a6b,ITC का FY25 annual guidance unchanged रहा,0,neutral,hinglish,generated,9
8bfbeb5099ae,"RBI policy meeting से पहले banking sector में caution, Adani Enterprises stable",0,neutral,hinglish,generated,3
33d77c13541e,"Technical charts पर Bajaj Finance neutral zone में है, RSI 50 के पास",0,neutral,hinglish,generated,10
e8c288ac72ec,Hindalco का FY23 annual guidance unchanged रहा,0,neutral,hinglish,generated,9
2286f4a46ea2,"एसबीआई का शुद्ध लाभ Q3 में 3.2% बढ़ा, विश्लेषक हुए उत्साहित",1,positive,hi,generated,3
b169cdb4e454,"IndusInd Bank का share 3.2% ऊपर गया, Q3 results ने सबको चौंकाया",1,positive,hinglish,generated,1
7b029212ca0f,Weak global cues से ITC और energy sector दोनों पर pressure,-1,negative,hinglish,generated,5
c1be6d82ff8b,"एक्सिस बैंक का मुनाफा 2.4% घटा, विश्लेषकों ने 'सेल' रेटिंग दी",-1,negative,hi,generated,2
09b25a9d2ddd,HCL Technologies का FY24 annual guidance unchanged रहा,0,neutral,hinglish,generated,9
2093bcb6418a,"Britannia board meeting होगी Friday को, कोई major announcement नहीं",0,neutral,hinglish,generated,4
e40332cec23e,"Bullish sentiment: BPCL में 1.1% की तेजी, brokerage target बढ़ाई",1,positive,hinglish,generated,5
f191ba20298f,Global markets uncertain — ONGC in wait-and-watch mode,0,neutral,hinglish,generated,13
13fb1590c93b,ओएनजीसी की बाजार हिस्सेदारी में 1.6% की गिरावट,-1,negative,hi,generated,15
1a265269aaab,"बजाज फाइनेंस के शेयर 6.1% उछले, मजबूत तिमाही नतीजों ने दिया बड़ा सहारा",1,positive,hi,generated,1
3b47cd2791f9,"एफआईआई ने एसबीआई में बड़ी खरीदारी की, स्टॉक 5.0% चढ़ा",1,positive,hi,generated,5
f89869a539ea,"अल्ट्राटेक सीमेंट के शेयर 5.0% उछले, मजबूत तिमाही नतीजों ने दिया बड़ा सहारा",1,positive,hi,generated,1
2f9cc041d018,Sun Pharma ने FY23 Q1 में analyst estimates को beat किया,1,positive,hinglish,generated,11
195f91ed6888,"रिलायंस के शेयर 1.2% टूटे, कमजोर नतीजों ने बाजार को निराश किया",-1,negative,hi,generated,1
82bfdf52c2e7,"FII ने IndusInd Bank में neutral stance लिया है, minor buying-selling",0,neutral,hinglish,generated,8
ab64e67fe3d7,"India PMI surge ने cement sector boost किया, ONGC 3.9% चढ़ा",1,positive,hinglish,generated,16
faed8640b54b,Mixed signals: Adani Enterprises का revenue beat हुआ लेकिन margins थोड़े miss,0,neutral,hinglish,generated,5
9df9cf70689c,"आईटीसी का कर्ज रिकॉर्ड स्तर पर, रेटिंग एजेंसी ने आउटलुक नेगेटिव किया",-1,negative,hi,generated,14
7848c49ce4c8,एचसीएल टेक में संस्थागत निवेशकों की हिस्सेदारी अपरिवर्तित,0,neutral,hi,generated,10
dd25abc82ce3,"सिप्ला का मुनाफा 1.2% घटा, विश्लेषकों ने 'सेल' रेटिंग दी",-1,negative,hi,generated,2
4b1ff072faa9,Mixed signals: SBI Life का revenue beat हुआ लेकिन margins थोड़े miss,0,neutral,hinglish,generated,5
9b81ba5e4267,सन फार्मा की बाजार हिस्सेदारी में 2.9% की गिरावट,-1,negative,hi,generated,15
be5b5b288b0a,"हिंदुस्तान यूनिलीवर के खिलाफ कर विभाग की कार्रवाई, शेयर निचले स्तर पर",-1,negative,hi,generated,12
16a8ef4c862f,"एलएंडटी का लाभांश रिकॉर्ड डेट जल्द, मूल्य प्रभाव सीमित",0,neutral,hi,generated,14
6e7178b6b021,Block deal: FII ने Britannia में ₹500 crore का stake खरीदा,1,positive,hinglish,generated,14
dccedd43f100,"मेटल सेक्टर सेक्टर में मिश्रित संकेत, टाटा मोटर्स स्थिर",0,neutral,hi,generated,5
5c039f4ad088,"टाटा मोटर्स के शेयर सपाट, बाजार Q1 नतीजों का इंतजार कर रहा है",0,neutral,hi,generated,1
bed795a24da0,बजट पूर्व सत्र में टीसीएस और मेटल सेक्टर सीमित दायरे में,0,neutral,hi,generated,13
6a806880ff36,"China slowdown का असर UltraTech Cement के exports पर, share price slips",-1,negative,hinglish,generated,17
c0c8ed38143f,"बाजार में तेजी: आईसीआईसीआई बैंक ने 2.7% की छलांग लगाई, निवेशकों में खुशी",1,positive,hi,generated,2
bcaa26cbc0ab,"Budget expectations से renewable energy sector flat, IndusInd Bank कोई बड़ी move नहीं",0,neutral,hinglish,generated,11
020c10bc4fc2,"अप्रैल में जेएसडब्ल्यू स्टील की बिक्री 3.9% उछली, बाजार का सेंटिमेंट बुलिश",1,positive,hi,generated,16
ab2bda65403d,बजट पूर्व सत्र में एनटीपीसी और बैंकिंग सेक्टर सीमित दायरे में,0,neutral,hi,generated,13
c857aa9c2e38,"टाटा मोटर्स के खिलाफ कर विभाग की कार्रवाई, शेयर निचले स्तर पर",-1,negative,hi,generated,12
230e6e0ccbc5,"आईटीसी के रिजल्ट की तारीख घोषित, विश्लेषक अनुमान के अनुरूप",0,neutral,hi,generated,7
1291c0ea4f2a,"Budget expectations से renewable energy sector flat, Coal India कोई बड़ी move नहीं",0,neutral,hinglish,generated,11
0ebd25693559,आरबीआई नीतिगत बैठक से पहले मारुति सुजुकी में सतर्कता,0,neutral,hi,generated,3
63948f54709a,Strong quarterly numbers: ONGC का EPS estimate से 8.3% ज़ादा,1,positive,hinglish,generated,18
706807ef5cf8,"RBI policy meeting से पहले telecom sector में caution, Reliance Industries stable",0,neutral,hinglish,generated,3
04579e2a1c3f,"Technical charts पर Tech Mahindra neutral zone में है, RSI 50 के पास",0,neutral,hinglish,generated,10
f2322bd401cb,"Technical charts पर Tata Motors neutral zone में है, RSI 50 के पास",0,neutral,hinglish,generated,10
ddf310b30d83,निफ्टी 50 स्थिर: सन फार्मा में सीमित दायरे में कारोबार,0,neutral,hi,generated,2
e748a06e7d05,"Global recession fears से IT sector में selloff, IndusInd Bank सबसे ज्यादा टूटा",-1,negative,hinglish,generated,11
9736260ec8b2,एसबीआई का तकनीकी चार्ट तटस्थ संकेत दे रहा है,0,neutral,hi,generated,9
8e95661622db,"टीसीएस ने FY26 में रिकॉर्ड राजस्व दर्ज किया, शेयर नई ऊंचाई पर",1,positive,hi,generated,4
342243f0f30e,"अप्रैल में एचसीएल टेक की बिक्री 8.3% उछली, बाजार का सेंटिमेंट बुलिश",1,positive,hi,generated,16
57757ff1c7a9,"Hindalco shares ne 52-week high छुआ, strong earnings के बाद",1,positive,hinglish,generated,4
551436a52b22,ग्लोबल मंदी की आशंका से बैंकिंग सेक्टर सेक्टर में एसबीआई पिछड़ा,-1,negative,hi,generated,13
0d791a1f5a15,"अदानी पोर्ट्स का मुनाफा 2.9% घटा, विश्लेषकों ने 'सेल' रेटिंग दी",-1,negative,hi,generated,2
cf941223ce73,मुद्रास्फीति में गिरावट: मेटल सेक्टर में टाइटन सबसे बड़ा फायदेमंद,1,positive,hi,generated,19
3012a8d50c25,"आरबीआई की सख्त नीति से एचसीएल टेक पर दबाव, 2.4% की गिरावट",-1,negative,hi,generated,8
9f18133d4b52,"Rising input costs ने Britannia को नुकसान पहुंचाया, stock slips 2.9%",-1,negative,hinglish,generated,7
12c069d00403,"सरकारी नीति में बदलाव से एनर्जी सेक्टर पर मार, बजाज फाइनेंस 8.6% नीचे",-1,negative,hi,generated,17
0736d5f250b3,टाइटन में संस्थागत निवेशकों की हिस्सेदारी अपरिवर्तित,0,neutral,hi,generated,10
645ef95ff69a,"नेस्ले के शेयर सपाट, बाजार Q3 नतीजों का इंतजार कर रहा है",0,neutral,hi,generated,1
596c0517c35c,"Market में sideways trend, Reliance Industries में कोई fresh trigger नहीं",0,neutral,hinglish,generated,7
6bf6cea5965e,ग्लोबल मंदी की आशंका से टेलीकॉम सेक्टर सेक्टर में एलएंडटी पिछड़ा,-1,negative,hi,generated,13
3d3434e8ff39,"बाजार में तेजी: एशियन पेंट्स ने 1.5% की छलांग लगाई, निवेशकों में खुशी",1,positive,hi,generated,2
bb3769122859,"सिप्ला का कर्ज रिकॉर्ड स्तर पर, रेटिंग एजेंसी ने आउटलुक नेगेटिव किया",-1,negative,hi,generated,14
1acaa313967c,"Bullish sentiment: SBI Life में 8.3% की तेजी, brokerage target बढ़ाई",1,positive,hinglish,generated,5
1959978c44fd,"अप्रैल में एक्सिस बैंक की बिक्री 1.1% उछली, बाजार का सेंटिमेंट बुलिश",1,positive,hi,generated,16
77e9112dbc0f,"भारती एयरटेल के शेयर 1.6% टूटे, कमजोर नतीजों ने बाजार को निराश किया",-1,negative,hi,generated,1
eefb3abaab09,"एचसीएल टेक का कर्ज रिकॉर्ड स्तर पर, रेटिंग एजेंसी ने आउटलुक नेगेटिव किया",-1,negative,hi,generated,14
d8ba03961c43,"ऑटो सेक्टर सेक्टर में मिश्रित संकेत, ओएनजीसी स्थिर",0,neutral,hi,generated,5
cd1d7f9d2165,"Tata Motors buyback approved by SEBI, shares jumped 3.4%",1,positive,hinglish,generated,13
c5403cadd439,"आईसीआईसीआई बैंक का पूंजी विस्तार योजना पर काम तेज, शेयर रिकॉर्ड ऊंचाई पर",1,positive,hi,generated,17
954fcf60fec5,पावर ग्रिड ने फार्मा सेक्टर में सबसे ज्यादा रिटर्न दिया इस तिमाही,1,positive,hi,generated,8
18922c2fbc6b,"एफआईआई ने एक्सिस बैंक में बड़ी खरीदारी की, स्टॉक 1.8% चढ़ा",1,positive,hi,generated,5
a19ffaf06d27,"India PMI surge ने banking sector boost किया, ONGC 3.2% चढ़ा",1,positive,hinglish,generated,16
439acd368429,"मेटल सेक्टर सेक्टर में मिश्रित संकेत, बजाज फाइनेंस स्थिर",0,neutral,hi,generated,5
8cb19ce4d019,नेस्ले का Q2 नतीजा बाजार की उम्मीद से काफी कमजोर,-1,negative,hi,generated,10
8889c4fdde2a,Block deal: FII ने Bajaj Finance में ₹500 crore का stake खरीदा,1,positive,hinglish,generated,14
9b9394c760b8,ब्रोकरेज हाउस ने आईटीसी को 'स्ट्रॉन्ग बाय' रेटिंग दी,1,positive,hi,generated,10
f810b6da8a24,"निफ्टी 50 में आईटीसी आज सबसे बड़ा गेनर, 4.8% की भारी बढ़त",1,positive,hi,generated,12
99a544821f86,डीआईआई की मजबूत खरीदारी से सिप्ला में बुलिश सेंटिमेंट,1,positive,hi,generated,13
92f04ae271d5,विदेशी निवेशकों ने सिप्ला में रिकॉर्ड निवेश किया इस सप्ताह,1,positive,hi,generated,15
c9b1f706812a,"एक्सिस बैंक का मुनाफा 7.5% घटा, विश्लेषकों ने 'सेल' रेटिंग दी",-1,negative,hi,generated,2
2c14a8283f0b,Block deal: FII ने Bajaj Auto में ₹500 crore का stake खरीदा,1,positive,hinglish,generated,14
1d5d0f47c528,Pidilite Industries 200-day moving average पर support ले रहा है,0,neutral,hinglish,generated,6
cdd37fb33660,"Maruti Suzuki का share 1.1% ऊपर गया, Q3 results ने सबको चौंकाया",1,positive,hinglish,generated,1
aab12d8b21ed,"Hero MotoCorp subsidiary का IPO 30x oversubscribed, parent भी चढ़ा",1,positive,hinglish,generated,17
d303339ac775,"IndusInd Bank market share 3.7% घटी, competition बढ़ा, stock दबाव में",-1,negative,hinglish,generated,15
cbe832e7625e,"अप्रैल में भारती एयरटेल की बिक्री 5.0% उछली, बाजार का सेंटिमेंट बुलिश",1,positive,hi,generated,16
e4f0dc11f31a,सन फार्मा की बाजार हिस्सेदारी में 1.4% की गिरावट,-1,negative,hi,generated,15
8d2468080a65,"Rising input costs ने Britannia को नुकसान पहुंचाया, stock slips 2.6%",-1,negative,hinglish,generated,7
c9d395a367a8,"निफ्टी 50 में अल्ट्राटेक सीमेंट आज सबसे बड़ा गेनर, 3.4% की भारी बढ़त",1,positive,hi,generated,12
d2e1ca1eb30e,"Shree Cement का trade volume below average, direction clear नहीं",0,neutral,hinglish,generated,14
183fc64ee755,"SEBI notice के बाद Bharti Airtel में panic selling, 1.2% की गिरावट",-1,negative,hinglish,generated,4
f790860ba156,"Rising input costs ने Tata Motors को नुकसान पहुंचाया, stock slips 3.1%",-1,negative,hinglish,generated,7
de29b6263a2b,"आरबीआई की सख्त नीति से अदानी एंटर्प्राइजेज पर दबाव, 6.3% की गिरावट",-1,negative,hi,generated,8
5139ea404b27,"Credit rating affirmed: Bajaj Auto AA+ पर stable, कोई बदलाव नहीं",0,neutral,hinglish,generated,0
3e7164d1696e,"इन्फोसिस का मुनाफा 1.4% घटा, विश्लेषकों ने 'सेल' रेटिंग दी",-1,negative,hi,generated,2
b61edec600b1,विदेशी बाजारों में मंदी से टाइटन में भारी बिकवाली,-1,negative,hi,generated,11
e02ed7cfcebe,"अप्रैल में हिंदुस्तान यूनिलीवर की बिक्री 3.9% उछली, बाजार का सेंटिमेंट बुलिश",1,positive,hi,generated,16
bfcc1c7e56cd,"रिलायंस के शेयर सपाट, बाजार Q3 नतीजों का इंतजार कर रहा है",0,neutral,hi,generated,1
8c2dfd5f895d,"इन्फोसिस के शेयर सपाट, बाजार Q4 नतीजों का इंतजार कर रहा है",0,neutral,hi,generated,1
998e55c220f9,"Market में sideways trend, Adani Enterprises में कोई fresh trigger नहीं",0,neutral,hinglish,generated,7
8c6cba647b36,"बजाज फाइनेंस के खिलाफ कर विभाग की कार्रवाई, शेयर निचले स्तर पर",-1,negative,hi,generated,12
efd72cee137c,"नेस्ले का पूंजी विस्तार योजना पर काम तेज, शेयर रिकॉर्ड ऊंचाई पर",1,positive,hi,generated,17
779b287f162c,सन फार्मा का Q2 नतीजा बाजार की उम्मीद से काफी कमजोर,-1,negative,hi,generated,10
5d3995b097ef,"Budget expectations से pharma sector flat, Apollo Hospitals कोई बड़ी move नहीं",0,neutral,hinglish,generated,11
5166d82ce8ac,"China slowdown का असर Coal India के exports पर, share price slips",-1,negative,hinglish,generated,17
1265cb78a9d5,मैनेजमेंट ने मारुति सुजुकी का वार्षिक मार्गदर्शन अपरिवर्तित रखा,0,neutral,hi,generated,0
20ca867686d5,"अदानी एंटर्प्राइजेज के शेयर सपाट, बाजार Q2 नतीजों का इंतजार कर रहा है",0,neutral,hi,generated,1
46556d308e55,"Technical charts पर HDFC Life neutral zone में है, RSI 50 के पास",0,neutral,hinglish,generated,10
66c0abc8e5b1,Mixed signals: Cipla का revenue beat हुआ लेकिन margins थोड़े miss,0,neutral,hinglish,generated,5
53a463d56f83,भारती एयरटेल ने ऑटो सेक्टर में सबसे ज्यादा रिटर्न दिया इस तिमाही,1,positive,hi,generated,8
66a52ac2b32b,"RBI की hawkish policy से cement sector hit, Bharti Airtel biggest loser",-1,negative,hinglish,generated,18
239c62c92992,"RBI की hawkish policy से energy sector hit, UltraTech Cement biggest loser",-1,negative,hinglish,generated,18
6690ce46550e,"SBI Life का share 2.7% ऊपर गया, Q3 results ने सबको चौंकाया",1,positive,hinglish,generated,1
cca800866652,"एनर्जी सेक्टर सेक्टर में मिश्रित संकेत, इन्फोसिस स्थिर",0,neutral,hi,generated,5
