datePublished,timestamp,timestamp_filled,trading_date,company,symbol,headline,description,articleBody,tags,author,url,source,language
2025-12-15,2025-12-15 19:07,2025-12-15 19:07,2025-12-16,Infosys,INFY,H-1B वीजा की 100000 डॉलर फीस का ज्यादा असर टीसीएस और इंफोसिस पर पड़ेगा,"एच-1बी वीजा के लिए ट्रंप की 100000 डॉलर की फीस का उन मल्टीनेशनल स्टाफिंग फर्मों पर असर पड़ेगा, जो एच-1बी वर्कर्स की तलाश वाली कंपनियों के लिए मिडिलमैन का काम करती हैं। इनमें टीसीएस, इंफोसिस और कॉग्निजेंट टेक्नोलॉजी सॉल्यूशंस जैसी कंपनियां शामिल हैं","अमेरिकी राष्ट्रपति डोनाल्ड ट्रंप के नए एच-1बी वीजा पर 1,00,000 डॉलर की फीस लगाने के फैसले का बड़ा असर आईटी आउटसोर्सिंग और स्टाफिंग इंडस्ट्रीज पर पड़ेगा। विदेशी वर्कर्स के लिए अमेरिका में काम करने के लिए एच-1बी वीजा जरूरी है। ब्लूमबर्ग की एनालिसिस के मुताबिक, इस फीस का उन मल्टीनेशनल स्टाफिंग फर्मों पर असर पड़ेगा, जो एच-1बी वर्कर्स की तलाश वाली कंपनियों के लिए मिडिलमैन का काम करती हैं। इनमें टीसीएस, इंफोसिस और कॉग्निजेंट टेक्नोलॉजी सॉल्यूशंस जैसी कंपनियां शामिल हैं। ये तीन कंपनियां एच-1बी वीजा का करती हैं ज्यादा इस्तेमाल मई 2020 से मई 2024 के बीच, इन तीनों कंपनियों के करीब 90 फीसदी एच-1बी वीजा अप्लिकेशंस को अमेरिकी कंसुलेट्स की मंजूरी मिली थी। एच-1बी वीजा पर नई फीस के चलते इन कंपनियों के लिए विदेशी वर्कर्स को अप्वाइंट करने के लिए लाखों डॉलर खर्च करने पड़ेंगे। मई 2020 से मई 2024 के बीच इंफोसिस ने 10,400 वर्कर्स की हायरिंग की थी, जिनमें से 93 फीसदी हायरिंग पर उसे एच-1बी वीजा फीस चुकाना पड़ सकता था। इससे उसका खर्च 1 अरब डॉलर से ज्यादा बढ़ जाता। 1,00,000 डॉलर की फीस का असर वीजा की डिमांड पर पड़ेगा टीसीएस को इस दौरान 6,500 वर्कर्स के लिए यह फीस चुकानी पड़ती, जो नए एच-1बी वीजा वर्कर्स का 82 फीसदी था। कॉग्निजेंट को 5,600 से ज्यादा वर्कर्स के लिए यह फीस चुकानी पड़ती, जो नए एच-1बी वीजा वर्कर्स का 89 फीसदी है। अगर कोर्ट में इसके खिलाफ याचिका की वजह से इस फीस पर रोक लग जाती है तो भी इंडस्ट्री का मानना है कि इससे वीजा की डिमांड में तेज गिरावट आएगी। इसका विदेश में वर्कर्स के प्लेसमेंट पर भी असर पड़ेगा। एच-1बी वीजा अमेरिका में करियर के लिए मुख्य रास्ता कई आईटी कंपनियों का प्रतिनिधित्व करने वाले इमिग्रेशन अटॉर्नी जोनाथन वासडेन ने कहा कि हम ऐसा होते हुए देख रहे हैं। इस बात का डर है कि अगर आपको विदेश में बहुत अच्छा टैलेंट दिख रहा है तो भी आप उसका फायदा नहीं उठा सकेंगे। लंबे समय से एच-1बी प्रोग्राम का ज्यादा इस्तेमाल बड़ी टेक्नोलॉजी और आईटी कंपनियां करती आ रही हैं। यह अमेरिका में करियर के लिए विदेशी वर्कर्स का मुख्य रास्ता रहा है। यह भी पढ़ें: Bitcoin Price: बिटकॉइन 90000 डॉलर से नीचे आया, इस गिरावट की क्या है वजह? कपनियां अमेरिकी वर्कर्स के सस्ते विकल्प के लिए करती हैं इस्तेमाल रिपब्लिकन और डेमोक्रेट्स दोनों दलों के सांसदों ने दावा किया है कि कंपनियां अमेरिकी वर्कर्स के सस्ते विकल्प के लिए इस प्रोग्राम का इस्तेमाल करती हैं। हालांकि, एच-1बी एंप्लॉयीज को उनकी इंडस्ट्री के हिसाब से सैलरी मिलनी चाहिए। आम तौर पर करियर की शुरुआत करने वाले एच-1बी वीजा वर्कर्स को औसत अमेरिकी सैलरी से ज्यादा पैसे मिलते हैं। हिंदी में शेयर बाजार , स्टॉक मार्केट न्यूज़ , बिजनेस न्यूज़ , पर्सनल फाइनेंस और अन्य देश से जुड़ी खबरें सबसे पहले मनीकंट्रोल हिंदी पर पढ़ें. डेली मार्केट अपडेट के लिए Moneycontrol App डाउनलोड करें।","TCS, Infosys, H-1B visa, Indian IT company, h-1b visa fees, donald trump, it industry, cognizant",MONEYCONTROL NEWS,https://hindi.moneycontrol.com/news/business/donald-trump-dollar-100000-h-1b-visa-fees-will-impact-infosys-and-tcs-heavily-2311479.html,moneycontrol_hindi,hi
2025-12-25,2025-12-25 10:37,2025-12-25 10:37,2025-12-25,Infosys,INFY,"Infosys ने फ्रेशर्स के लिए बढ़ाई सैलरी, अब ₹21 लाख तक का पैकेज कर रही ऑफर",Infosys Salary: इंफोसिस 2025 के इंजीनियरिंग और कंप्यूटर साइंस ग्रेजुएट्स के लिए एक ऑफ-कैंपस हायरिंग ड्राइव शुरू कर रही है। ऑफर किए जा रहे रोल्स में स्पेशलिस्ट प्रोग्रामरऔर डिजिटल स्पेशलिस्ट इंजीनियर शामिल हैं,"IT कंपनी इंफोसिस (Infosys) ने फ्रेशर्स के लिए एंट्री-लेवल सैलरी बढ़ा दी है। स्पेशलाइज्ड टेक्नोलॉजी रोल्स के लिए सालाना 21 लाख रुपये तक के पैकेज दिए जा रहे हैं। कंपनी AI-फर्स्ट क्षमताओं को मजबूत करने और डिजिटल रूप से टैलेंटेड लोगों को आकर्षित करने के लिए हायरिंग बढ़ा रही है। नए डेवलपमेंट से इंफोसिस भारतीय IT फर्मों में एंट्री लेवल पर सबसे ज्यादा सैलरी देने वाली कंपनी बन गई है। मनीकंट्रोल द्वारा रिव्यू और वेरिफाई किए गए सोशल मीडिया पोस्ट और बैनर के अनुसार, इंफोसिस 2025 के इंजीनियरिंग और कंप्यूटर साइंस ग्रेजुएट्स के लिए एक ऑफ-कैंपस हायरिंग ड्राइव शुरू कर रही है। मकसद स्पेशलाइज्ड टेक्नोलॉजी रोल्स के लिए टैलेंट को रिक्रूट करना है। सालाना पैकेज 7 लाख से 21 लाख रुपये तक का होगा। ऑफर किए जा रहे रोल्स में स्पेशलिस्ट प्रोग्रामर (L1 से L3) और डिजिटल स्पेशलिस्ट इंजीनियर (ट्रेनी) शामिल हैं। ये रोल कंप्यूटर साइंस, IT के साथ-साथ ECE और EEE जैसी चुनिंदा सर्किट ब्रांच के BE, BTech, ME, MTech, MCA और इंटीग्रेटेड MSc ग्रेजुएट्स के लिए ओपन हैं। स्पेशलिस्ट प्रोग्रामर L3 (ट्रेनी) कि लिए 21 लाख रुपये सालाना, स्पेशलिस्ट प्रोग्रामर L2 (ट्रेनी) के लिए 16 लाख रुपये सालाना, स्पेशलिस्ट प्रोग्रामर L1 (ट्रेनी) के लिए 11 लाख रुपये सालाना और डिजिटल स्पेशलिस्ट इंजीनियर (ट्रेनी) के लिए 7 लाख रुपये सालाना के पैकेज की पेशकश की जा रही है। इंफोसिस ग्रुप के चीफ ह्यूमन रिसोर्सेज ऑफिसर शाजी मैथ्यू ने मनीकंट्रोल को बताया कि कंपनी अपनी सभी सर्विसेज में AI-फर्स्ट अप्रोच अपना रही है। इसके लिए मौजूदा कर्मचारियों की अपस्किलिंग और गहरी विशेषज्ञता वाले डिजिटली टैलेंटेड लोगों को लाने की जरूरत है। उन्होंने सवालों के जवाब में कहा, ""हमारी शुरुआती करियर हायरिंग में कैंपस और ऑफ-कैंपस ड्राइव शामिल हैं, और हमने स्पेशलिस्ट प्रोग्रामर ट्रैक में अवसर बढ़ाए हैं। इसमें सालाना 21 लाख रुपये तक के पैकेज दिए जा रहे हैं।"" कर्मचारियों पर निवेश नहीं कर रहे प्राइवेट बैंक, यही टैलेंट क्राइसिस की बड़ी वजह: SBI चेयरमैन सीएस शेट्टी इंफोसिस में इस साल कितने फ्रेशर्स की हायरिंग इंफोसिस ने वित्त वर्ष 2026 की पहली छमाही के लिए 12,000 फ्रेशर्स को हायर किया। कंपनी इस साल 20,000 फ्रेशर्स को हायर करने के अपने टारगेट को पूरा करने की राह पर है। यह बात इंफोसिस के CFO जयेश संघराजका ने 16 अक्टूबर 2025 को कंपनी के सितंबर तिमाही के नतीजे जारी करने के दौरान कही थी। सितंबर 2025 तिमाही में कंपनी ने 8,203 कर्मचारियों को जोड़ा। हिंदी में शेयर बाजार , स्टॉक मार्केट न्यूज़ , बिजनेस न्यूज़ , पर्सनल फाइनेंस और अन्य देश से जुड़ी खबरें सबसे पहले मनीकंट्रोल हिंदी पर पढ़ें. डेली मार्केट अपडेट के लिए Moneycontrol App डाउनलोड करें।","Infosys salary, Infosys package for freshers, Infosys entry level salary, Infosys hiring, इंफोसिस सैलरी, फ्रेशर्स के लिए इंफोसिस का पैकेज, इंफोसिस में एंट्री लेवल सैलरी, इंफोसिस हायरिंग, moneycontrol, moneycontrol hindi, business news in hindi",Ritika Singh,https://hindi.moneycontrol.com/news/business/infosys-has-raised-entry-level-salaries-for-freshers-with-compensation-packages-of-up-to-rs-21-lakh-per-annum-2320310.html,moneycontrol_hindi,hi
