datePublished,timestamp,timestamp_filled,trading_date,company,symbol,headline,description,articleBody,tags,author,url,source,language
2025-11-25,2025-11-25 11:55,2025-11-25 11:55,2025-11-25,ITC,ITC,"BitCoin Fall: बिटक्वॉइन को तीन साल का सबसे बड़ा झटका, फिर पहुंचेगा $1 लाख के पार या आएगा और नीचे?","BitCoin Fall: मार्केट कैप के हिसाब से दुनिया की सबसे बड़ी क्रिप्टोकरेंसी बिटक्वाइन के लिए यह महीना काफी बुरा साबित हुआ है। तीन साल में मंथली सबसे तेज स्पीड से गिरते हुए यह सात महीने के निचले स्तर पर आ गया। जानिए इस गिरावट की वजह क्या है, आगे क्या रुझान है, एक्सपर्ट्स का इसे लेकर क्या कहना है?","BitCoin Fall: इस महीने नवंबर में बिटक्वॉइन की चमक 21% से अधिक फीकी हुई है जो जून 2022 के बाद से इसके भाव में सबसे बड़ी गिरावट है। पिछले महीने अक्टूबर की शुरुआत में एक बिटक्वॉइन $1.26 लाख के आस-पास भाव पर था लेकिन अब यह $81 हजार से भी कम में मिल रहा है यानी कि निवेशकों की के निवेश की वैल्यू महज एक महीने से थोड़े ही अधिक समय में 33% कम हो गई। चूंकि दुनिया भर में क्रिप्टो मार्केट में सबसे अधिक लेन-देन बिटक्वॉइन का ही होता है तो इसकी गिरावट ने दूसरे अहम आल्टक्वॉइन्स की भी झटका दिया और इनकी चमक फीकी की। बिटक्वॉइन की चमक इसके ईटीएफ से ताबड़तोड़ निकासी ने कम की। इससे ब्लैकरॉक के iShares Bitcoin Trust (IBIT) को सबसे बड़ा झटका लगा। केवल नवंबर में ही IBIT से लगभग $300 करोड़ की नेट निकासी हुई। इसमें तो एक ही दिन में रिकॉर्ड $52.3 करोड़ की निकासी भी शामिल है। नवंबर में IBIT से कुल $210 करोड़ की मासिक निकासी हुई, जो सभी बिटक्वॉइन ईटीएफ से निकासी का लगभग 71% हिस्सा रहा। कुल मिलाकर स्पॉट बिटकॉइन ईटीएफ की वैल्यू करीब $300 करोड़ खो गई तो एथेरियम ईटीएफ से भी $179 करोड़ की भी निकासी हुई। हालांकि दूसरी तरफ सोलाना जैसे कुछ निच फंड्स में इस दौरान निकासी से अधिक निवेश आया। मार्केट एक्सपर्ट्स का कहना है कि बिटक्वॉइन के एक बड़े होल्डर ने अक्टूबर महीने के आखिरी दिनों और नवंबर के शुरुआती दिनों में करीब $130 करोड़ की होल्डिंग बेची तो क्रिप्टो मार्केट में कोहराम मच गया। इसके साथ ही मैक्रोइकनॉमिक डेटा और अमेरिकी फेड की तरफ से ब्याज दरों के कटौती की फीकी उम्मीदों पर यह और फिसल गया। एआई और टेक सेक्टर में बढ़ती अस्थिरता क्रिप्टो बाजार में भी फैल गई। ईटीएफ से निकासी और घटती इंस्टीट्यूशनल हिस्सेदारी से भी क्रिप्टो मार्केट की रौनक फीकी हुई। क्रिप्टो मार्केट से जुड़े बिल के अमेरिकी कांग्रेस में लटकने से अनिश्चितता बढ़ी और क्रिप्टो मार्केट में निराशा फैल गई। BitCoin की गिरावट पर क्या कहना है मार्केट एक्सपर्ट्स का? फिनरेक्स ट्रेजरी एडवाइजर्स एलएलपी के ट्रेजरी हेड अनिल कुमार भंसाली का कहना है कि ईटीएफ से निकासी की शुरुआत बिटकॉइन के प्रमुख टेक्निकल लेवल्स के नीचे गिरने, फेडरल रिजर्व की दर कटौती की उम्मीदों में कमी, और संस्थागत शॉर्ट-सेलिंग के बढ़ने से हुई। पाइनट्री मैक्रो के फाउंडर रितेश जैन का कहना है कि बिटक्वॉइन को लेकर खुदरा मांग सुस्त हुई है जो आमतौर पर ईटीएफ के जरिए आती है। इसके अलावा 10 साल से भी अधिक समय से बिटक्वॉइन होल्ड करने वाले निवेशकों की बिकवाली ने भी दबाव बनाया। रितेश का कहना है कि बिटक्वॉइन को लेकर लॉन्ग टर्म में फिलहाल उनका कोई रुझान नहीं है लेकिन शॉर्ट टर्म में यह ओवरसोल्ड जोन में आ चुका है और इसे मौजूदा भाव के आस-पास स्थिर हो जाना चाहिए, कम से कम अमेरिकी फेड की अगली बैठक तक ही सही। डिस्क्लेमर: मनीकंट्रोल.कॉम पर दिए गए सलाह या विचार एक्सपर्ट/ब्रोकरेज फर्म के अपने निजी विचार होते हैं। वेबसाइट या मैनेजमेंट इसके लिए उत्तरदायी नहीं है। यूजर्स को मनीकंट्रोल की सलाह है कि कोई भी निवेश निर्णय लेने से पहले हमेशा सर्टिफाइड एक्सपर्ट की सलाह लें। हिंदी में शेयर बाजार , स्टॉक मार्केट न्यूज़ , बिजनेस न्यूज़ , पर्सनल फाइनेंस और अन्य देश से जुड़ी खबरें सबसे पहले मनीकंट्रोल हिंदी पर पढ़ें. डेली मार्केट अपडेट के लिए Moneycontrol App डाउनलोड करें।","crypto,crypto news, cryptocurrencies, bitcoin,bitcoin price,bitcoin news, bitcoin etf,world largest crypto, moneycontrol,business news in hindi,क्रिप्टो की खबरें, क्रिप्टोकरेंसीज,बिटक्वाइन,बिटक्वाइन प्राइस,बिटक्वाइन में गिरावट क्यों, बिटक्वाइन की खबरें,",Jeevan Deep Vishawakarma,https://hindi.moneycontrol.com/news/markets/bitcoin-price-tanks-21-percent-in-november-steepest-since-june-2022-as-etf-outflows-surge-2292913.html,moneycontrol_hindi,hi
2026-03-22,2026-03-22 11:13,2026-03-22 11:13,2026-03-23,ITC,ITC,"BitCoin टूटकर आया $68300 के भी नीचे, इस कारण क्रिप्टो मार्केट में हाहाकार, टॉप-10 करेंसीज की ऐसी है हालत","Crypto Price: क्रिप्टो मार्केट में आज ऐसा कोहराम दिखा कि मार्केट कैप के हिसाब से दुनिया के सबसे बड़े क्रिप्टो बिटकॉइन $68300 के भी नीचे आ गया। सिर्फ यही नहीं, टॉप-10 के बाकी क्रिप्टो का भी हाल अच्छा नहीं है। जानिए बिकवाली का यह दबाव क्यों आया  और इन क्रिप्टो की वीकली स्थिति कैसी है","Crypto Price: क्रिप्टो मार्केट में आज बिकवाली का काफी दबाव दिखा। अमेरिकी राष्ट्रपति डोनाल्ड ट्रंप के बदले रुझान ने कोहराम मचा दिया है। लड़ाई बंद करने के विचार से पावर प्लांट्स तबाह करने की चेतावनी तक एकाएक ट्रंप के बदले रुख पर क्रिप्टो मार्केट में बिकवाली की आंधी चलने लगी। इस आंधी में मार्केट कैप के हिसाब से दुनिया का सबसे बड़ा क्रिप्टो बिटकॉइन (BitCoin) तो ऐसा फिसला कि एक बार तो यह $69000 के नीचे $$68,265.83 तक आ गया। निचले स्तर पर रिकवरी के बावजूद अभी भी इसमें 2% की गिरावट है। वहीं दूसरे सबसे बड़े क्रिप्टो एथेरियम (Ethereum) की चमक भी डेढ़ फीसदी से अधिक फीकी पड़ी है। पूरे क्रिप्टो मार्केट की बात करें तो पिछले 24 घंटे में वैश्विक मार्केट कैप में 1.60% की गिरावट आई है और यह $2.38 लाख करोड़ (₹223.75 लाख करोड़) पर आ गया है। मार्केट कैप के हिसाब से टॉप-10 का कोई क्रिप्टो ग्रीन नहीं है। हालांकि वीकली बात करें तो मार्केट कैप के हिसाब से सिर्फ चार क्रिप्टो- बिटकॉइन, टेथर, बीएनबी और डॉगकॉइन ही लाल हैं। यहां मार्केट कैप के हिसाब से दुनिया के 10 सबसे बड़ी क्रिप्टोकरेंसीज, उनके भाव में 24 घंटे और एक हफ्ते में उतार-चढ़ाव की डिटेल दी जा रही है- क्रिप्टो मौजूदा भाव 24 घंटे में उतार-चढ़ाव 7 दिन में उतार-चढ़ाव बिटकॉइन (BitCoin) $69,267.66 (-) 2.01% (-) 3.16% एथेरियम (Ethereum) $2,118.57 (-) 1.59% 0.73% टेथर (Tether) $1.00 (-) 0.01% (-) 0.02% एक्सआरपी (XRP) $1.41 (-) 2.05% 0.04% बीएनबी (BNB) $633.97 (-) 1.28% (-) 3.79% यूएसडी कॉइन (USD Coin) $0.9998 (-) 0.01% 0.00% सोलाना (Solana) $88.83 (-) 1.63% 0.73% ट्रॉन (Tron) $0.3083 (-) 0.20% 4.04% डॉगकॉइन (DogeCoin) $0.09265 (-) 2.09% (-) 3.34% हाइपरलिक्विड (Hyperliquid) $38.88 (-) 1.48% 2.85% सोर्स: कॉइनमार्केटकैप, भाव खबर लिखे जाने के समय पिछले 24 घंटे में क्रिप्टो के लेन-देन में गिरावट आई है। कॉइनमार्केटकैप पर उपलब्ध आंकड़ों के मुताबिक एक दिन में $6285 करोड़ (₹5.91 लाख करोड़) क्रिप्टो का लेन-देन हुआ जो पिछले दिन की तुलना में 23.13% कम रहा। पिछले 24 घंटे में क्रिप्टो मार्केट में BitCoin की स्थिति 0.17% कमजोर हुई है और क्रिप्टो बाजार में अब इसकी 58.18% हिस्सेदारी है। Why Bitcoin is falling: $68000 के नीचे आया बिटकॉइन, इस कारण क्रिप्टो मार्केट में हाहाकार, हिंदी में शेयर बाजार , स्टॉक मार्केट न्यूज़ , बिजनेस न्यूज़ , पर्सनल फाइनेंस और अन्य देश से जुड़ी खबरें सबसे पहले मनीकंट्रोल हिंदी पर पढ़ें. डेली मार्केट अपडेट के लिए Moneycontrol App डाउनलोड करें।","bitcoin,cryptocurrency, Ethereum, tether, usd coin, bnb, binance usd, xrp, cardano, solana,polkadot, क्रिप्टोकरेंसी, बिटकॉइन, एथेरम, टेथर, यूएसडी कॉइन, बीएनबी, बिनांस यूएसडी, एक्सआरपी, कार्डानो,डॉजकॉइन, dogecoin, पॉलीगॉन,Polygon,moneycontrol hindi, moneycontrol, मनीकंट्रोल, मनीकंट्रोल हिंदी,ट्रॉन,Tr",Moneycontrol Hindi News,https://hindi.moneycontrol.com/news/business/crypto-market-biggest-crypto-bitcoin-price-slips-below-usd-68000-ethereum-down-check-top-10-cryptocurrencies-price-today-amid-us-iran-war-trump-warning-2384975.html,moneycontrol_hindi,hi
2026-04-02,2026-04-02 02:28,2026-04-02 02:28,2026-04-02,ITC,ITC,खतरे में बिटकॉइन और इथेरियम जैसी क्रिप्टोकरेंसी?,"Google की नई स्टडी ने क्वांटम कंप्यूटिंग से Bitcoin और Ethereum के पासवर्ड सिक्योरिटी सुरक्षा पर सवाल खड़े किए हैं। इसके मुताबिक, इन पासवर्ड को 9 मिनट के भीतर क्रैक किया जा सकता है। जानिए इस पर क्रिप्टो इंडस्ट्री के जानकारों की क्या राय है और क्या क्रिप्टो ट्रेडर्स को डरना चाहिए।","Google की नई स्टडी ने क्वांटम कंप्यूटिंग से Bitcoin और Ethereum के पासवर्ड सिक्योरिटी सुरक्षा पर सवाल खड़े किए हैं। इसके मुताबिक, इन पासवर्ड को 9 मिनट के भीतर क्रैक किया जा सकता है। जानिए इस पर क्रिप्टो इंडस्ट्री के जानकारों की क्या राय है और क्या क्रिप्टो ट्रेडर्स को डरना चाहिए।","crypto currency, bitcoin, ethereum, quantum computers, moneycontrol hindi,",MONEYCONTROL NEWS,https://hindi.moneycontrol.com/news/videos/markets/google-warns-quantum-computers-could-break-bitcoin-and-ethereum-security-sooner-than-expected-what-it-means-for-crypto-investors-and-future-of-blockchain-watch-video-to-know-2388275.html,moneycontrol_hindi,hi
